title,topic_1,label_1,topic_2,label_2,p1,p2,margin
"Supported crypto deposit currencies, networks, and exchanges",9,Crypto deposit troubleshooting,16,Revolut crypto trading and setup,0.564,0.181,0.383
Open a Revolut – Kids & Teens account,10,Managing Kids and Teens accounts,24,Currency accounts and exchange fees,0.493,0.11,0.383
Can I reopen my closed account?,4,Joint account closure,3,Identity and account verification,0.51,0.126,0.384
How do I add cards to Click to Pay?,1,Card payment troubleshooting,27,Account security and fraud protection,0.558,0.175,0.384
Pending crypto withdrawals,9,Crypto deposit troubleshooting,16,Revolut crypto trading and setup,0.62,0.234,0.386
Difficulty logging in,3,Identity and account verification,23,eSIM data plan management,0.514,0.128,0.386
I was asked for additional information about my transaction,3,Identity and account verification,25,Download account statements,0.513,0.127,0.386
Fees for card payments in a foreign currency,6,Currency exchange and withdrawal fees,15,Downgrading paid plans,0.533,0.146,0.387
What do I need to do to move my account to a bank account?,4,Joint account closure,21,External bank account transfers,0.545,0.158,0.387
Tips for spending in a foreign currency,24,Currency accounts and exchange fees,6,Currency exchange and withdrawal fees,0.669,0.277,0.392
Understanding mobile plan numbers,23,eSIM data plan management,15,Downgrading paid plans,0.621,0.229,0.392
What is Revolut ID?,3,Identity and account verification,20,Tax and national identification,0.554,0.161,0.393
Trading with crypto tiered pricing,6,Currency exchange and withdrawal fees,16,Revolut crypto trading and setup,0.548,0.155,0.393
Revolut data plans,23,eSIM data plan management,15,Downgrading paid plans,0.571,0.178,0.393
I want to close my Joint account,4,Joint account closure,21,External bank account transfers,0.573,0.179,0.394
Card customisation,22,Ordering new cards,1,Card payment troubleshooting,0.565,0.17,0.395
Locate a bank transfer sent from Revolut,11,Transfer status and delays,21,External bank account transfers,0.551,0.154,0.397
Can I order my card to a different address?,22,Ordering new cards,1,Card payment troubleshooting,0.534,0.136,0.398
Is my crypto safe with Revolut?,16,Revolut crypto trading and setup,27,Account security and fraud protection,0.551,0.151,0.4
Can I keep my e-money account?,4,Joint account closure,19,FSCS protection for Revolut accounts,0.54,0.136,0.404
Decline reasons on Apple Pay and Google Pay,1,Card payment troubleshooting,7,Referral purchase step requirements,0.587,0.183,0.404
What is Click to Pay?,1,Card payment troubleshooting,23,eSIM data plan management,0.561,0.157,0.404
How do I provide proof of address?,3,Identity and account verification,25,Download account statements,0.52,0.116,0.404
Revolut - Kids & Teens Referrals,10,Managing Kids and Teens accounts,7,Referral purchase step requirements,0.642,0.237,0.405
How can I remove my card from Click to Pay?,1,Card payment troubleshooting,22,Ordering new cards,0.612,0.206,0.406
Buying or selling commodities,2,Trading order types,24,Currency accounts and exchange fees,0.634,0.228,0.406
Documents for the source of funds verification,25,Download account statements,3,Identity and account verification,0.508,0.101,0.407
What are Revolut's safety features?,27,Account security and fraud protection,23,eSIM data plan management,0.52,0.113,0.408
Can I accept payments with Revolut Pro?,1,Card payment troubleshooting,6,Currency exchange and withdrawal fees,0.539,0.131,0.408
Getting started with Pockets,26,Managing Revolut Pockets,10,Managing Kids and Teens accounts,0.519,0.11,0.408
What is the consolidated statement?,25,Download account statements,20,Tax and national identification,0.586,0.178,0.408
Why was I charged more than I was shown?,6,Currency exchange and withdrawal fees,24,Currency accounts and exchange fees,0.515,0.105,0.409
How to calculate interest on Savings accounts,19,FSCS protection for Revolut accounts,4,Joint account closure,0.559,0.15,0.409
Crypto spare change,26,Managing Revolut Pockets,12,RevPoints loyalty program,0.546,0.136,0.411
Transfer I sent arrived in a different currency ,24,Currency accounts and exchange fees,11,Transfer status and delays,0.556,0.144,0.412
Advantages of investing in bonds,14,Crypto ETNs and ETPs,20,Tax and national identification,0.609,0.197,0.412
Completing the 'Make purchases' step,7,Referral purchase step requirements,1,Card payment troubleshooting,0.616,0.202,0.413
Reasons an investment account may be closed,4,Joint account closure,20,Tax and national identification,0.567,0.154,0.413
How does converting cryptocurrency to fiat currency work?,2,Trading order types,16,Revolut crypto trading and setup,0.637,0.224,0.413
Does the account transfer impact my plan insurance cover?,0,Travel insurance trip coverage,26,Managing Revolut Pockets,0.565,0.152,0.413
What are Pro Pockets?,26,Managing Revolut Pockets,20,Tax and national identification,0.576,0.16,0.415
Why is my incoming transfer pending?,11,Transfer status and delays,21,External bank account transfers,0.612,0.196,0.416
Accessing Revolut X,3,Identity and account verification,5,Reporting phone and payment scams,0.602,0.185,0.417
Problem with a Direct Debit,17,Managing scheduled transfers,24,Currency accounts and exchange fees,0.59,0.172,0.418
Tier progression and account changes,6,Currency exchange and withdrawal fees,16,Revolut crypto trading and setup,0.623,0.205,0.419
Crypto account onboarding requirements,16,Revolut crypto trading and setup,9,Crypto deposit troubleshooting,0.55,0.131,0.419
Am I eligible for Apple Pay?,8,Supported currencies and cards,1,Card payment troubleshooting,0.63,0.211,0.42
Failed payments on the Revolut Terminal,1,Card payment troubleshooting,23,eSIM data plan management,0.574,0.153,0.421
Can I cancel or edit a card order?,22,Ordering new cards,2,Trading order types,0.558,0.135,0.422
What is Trading Pro?,6,Currency exchange and withdrawal fees,2,Trading order types,0.579,0.158,0.422
What are the fees for Trading Pro?,6,Currency exchange and withdrawal fees,13,Accessing Revolut plan benefits,0.695,0.27,0.425
What are the requirements for 3 purchases?,7,Referral purchase step requirements,1,Card payment troubleshooting,0.548,0.123,0.425
How do I access a partner benefit?,13,Accessing Revolut plan benefits,15,Downgrading paid plans,0.6,0.175,0.425
The Athletic,13,Accessing Revolut plan benefits,15,Downgrading paid plans,0.583,0.158,0.425
Setting up a Joint account,4,Joint account closure,21,External bank account transfers,0.553,0.126,0.426
Download transaction or top-up statement,25,Download account statements,15,Downgrading paid plans,0.567,0.141,0.426
Revolut Kids & Teens Payment Links,10,Managing Kids and Teens accounts,1,Card payment troubleshooting,0.556,0.13,0.426
Setting a monthly spending limit,1,Card payment troubleshooting,22,Ordering new cards,0.667,0.239,0.428
Currency exchange fees and limits,6,Currency exchange and withdrawal fees,13,Accessing Revolut plan benefits,0.573,0.144,0.428
Paid plan downgrade fees ,15,Downgrading paid plans,6,Currency exchange and withdrawal fees,0.613,0.179,0.434
What is an event?,0,Travel insurance trip coverage,15,Downgrading paid plans,0.581,0.143,0.438
Crypto private keys and exposure on the blockchain,16,Revolut crypto trading and setup,9,Crypto deposit troubleshooting,0.678,0.237,0.44
Maximum active cards,22,Ordering new cards,1,Card payment troubleshooting,0.624,0.182,0.442
Linking your airline loyalty account,12,RevPoints loyalty program,4,Joint account closure,0.617,0.174,0.443
Laundryheap,13,Accessing Revolut plan benefits,15,Downgrading paid plans,0.567,0.124,0.443
Order a physical card,22,Ordering new cards,1,Card payment troubleshooting,0.562,0.119,0.443
American depositary receipts (ADRs) and pass-through fees,6,Currency exchange and withdrawal fees,25,Download account statements,0.578,0.135,0.443
Submitting documents for a travel insurance claim,0,Travel insurance trip coverage,25,Download account statements,0.628,0.185,0.444
Can I choose between Mastercard and Visa?,22,Ordering new cards,1,Card payment troubleshooting,0.631,0.181,0.45
Purchase protection coverage,0,Travel insurance trip coverage,13,Accessing Revolut plan benefits,0.572,0.121,0.451
Managing a Revolut – Kids & Teens account,10,Managing Kids and Teens accounts,4,Joint account closure,0.598,0.145,0.453
Using the Income Sorter feature,26,Managing Revolut Pockets,4,Joint account closure,0.591,0.137,0.453
Headspace,13,Accessing Revolut plan benefits,15,Downgrading paid plans,0.604,0.148,0.456
Stock basics,2,Trading order types,14,Crypto ETNs and ETPs,0.629,0.171,0.459
Why did I receive a smaller reward for a Referral than you advertised in the app?,7,Referral purchase step requirements,0,Travel insurance trip coverage,0.594,0.134,0.46
WeWork,13,Accessing Revolut plan benefits,15,Downgrading paid plans,0.585,0.122,0.463
"Add, edit, or delete a beneficiary",17,Managing scheduled transfers,21,External bank account transfers,0.621,0.157,0.464
Upgrade my plan,15,Downgrading paid plans,13,Accessing Revolut plan benefits,0.586,0.122,0.464
Schedule a transfer,17,Managing scheduled transfers,11,Transfer status and delays,0.619,0.154,0.465
How to complete 'Make purchases' step for Referrals reward,7,Referral purchase step requirements,22,Ordering new cards,0.574,0.108,0.466
What gambling support is available?,18,Reporting vulnerable circumstances,20,Tax and national identification,0.702,0.235,0.466
How are the funds in my Savings accounts protected?,19,FSCS protection for Revolut accounts,4,Joint account closure,0.584,0.117,0.467
How can I keep my account safe from fraud?,5,Reporting phone and payment scams,22,Ordering new cards,0.642,0.176,0.467
Finding your gift cards,12,RevPoints loyalty program,22,Ordering new cards,0.664,0.195,0.468
Why is my stock on 'sell only'?,2,Trading order types,17,Managing scheduled transfers,0.687,0.218,0.468
Redeem RevPoints,12,RevPoints loyalty program,26,Managing Revolut Pockets,0.592,0.121,0.471
What information do I need to provide to onboard to trading?,20,Tax and national identification,4,Joint account closure,0.59,0.115,0.474
Headway,13,Accessing Revolut plan benefits,18,Reporting vulnerable circumstances,0.586,0.111,0.476
Where can I pay with Apple Pay or Google Pay?,1,Card payment troubleshooting,7,Referral purchase step requirements,0.691,0.215,0.476
Why is my travel insurance coverage ending?,0,Travel insurance trip coverage,15,Downgrading paid plans,0.677,0.2,0.477
Merger or acquisition of a company whose shares I own,2,Trading order types,14,Crypto ETNs and ETPs,0.653,0.175,0.478
Cancel for any reason complaints,0,Travel insurance trip coverage,18,Reporting vulnerable circumstances,0.595,0.117,0.478
What types of orders can I create on Revolut X?,2,Trading order types,6,Currency exchange and withdrawal fees,0.595,0.116,0.479
How to earn RevPoints,12,RevPoints loyalty program,15,Downgrading paid plans,0.591,0.111,0.48
Downgrading your paid plan,15,Downgrading paid plans,13,Accessing Revolut plan benefits,0.617,0.135,0.482
Getting started with travel insurance,0,Travel insurance trip coverage,13,Accessing Revolut plan benefits,0.596,0.114,0.482
Rate decrease on my Instant Access Savings,19,FSCS protection for Revolut accounts,24,Currency accounts and exchange fees,0.605,0.122,0.483
Timeframes for transfers,11,Transfer status and delays,21,External bank account transfers,0.699,0.214,0.485
I can't send a transfer or create a recipient,11,Transfer status and delays,17,Managing scheduled transfers,0.62,0.133,0.487
Claiming after Premium travel insurance removal,0,Travel insurance trip coverage,15,Downgrading paid plans,0.6,0.113,0.487
Return or manage crypto deposits,9,Crypto deposit troubleshooting,16,Revolut crypto trading and setup,0.696,0.205,0.492
Gifting a paid plan,15,Downgrading paid plans,0,Travel insurance trip coverage,0.608,0.116,0.493
Purchase RevPoints in app,12,RevPoints loyalty program,26,Managing Revolut Pockets,0.616,0.124,0.493
Are funds in my  independent teen account FSCS protected?,19,FSCS protection for Revolut accounts,4,Joint account closure,0.658,0.165,0.493
Sales using a Revolut Pro product catalogue,17,Managing scheduled transfers,20,Tax and national identification,0.63,0.136,0.494
Revolut - Kids & Teens statements,10,Managing Kids and Teens accounts,25,Download account statements,0.634,0.141,0.494
I found my lost card,22,Ordering new cards,1,Card payment troubleshooting,0.7,0.203,0.497
Withdrawing from Pockets,26,Managing Revolut Pockets,10,Managing Kids and Teens accounts,0.614,0.116,0.498
How can I file a complaint?,18,Reporting vulnerable circumstances,3,Identity and account verification,0.613,0.115,0.498
"My friend made 3 purchases, but I didn’t get the reward",7,Referral purchase step requirements,1,Card payment troubleshooting,0.602,0.103,0.499
Perplexity,13,Accessing Revolut plan benefits,15,Downgrading paid plans,0.662,0.163,0.499
Add a new wallet to withdraw crypto,9,Crypto deposit troubleshooting,16,Revolut crypto trading and setup,0.703,0.204,0.499
Managing joint account ownership,4,Joint account closure,21,External bank account transfers,0.618,0.117,0.501
Cash withdrawal limits and fees,6,Currency exchange and withdrawal fees,24,Currency accounts and exchange fees,0.634,0.134,0.501
Make a Stays booking,12,RevPoints loyalty program,1,Card payment troubleshooting,0.687,0.185,0.502
Cancelling your scheduled plan downgrade,15,Downgrading paid plans,17,Managing scheduled transfers,0.643,0.142,0.502
Making a donation through Revolut,26,Managing Revolut Pockets,12,RevPoints loyalty program,0.74,0.237,0.503
What currency will I be charged in?,24,Currency accounts and exchange fees,6,Currency exchange and withdrawal fees,0.609,0.107,0.503
Who provides Ultra trip and event cancellation protection?,0,Travel insurance trip coverage,13,Accessing Revolut plan benefits,0.734,0.228,0.505
Unsupported transfers sent from Revolut,8,Supported currencies and cards,10,Managing Kids and Teens accounts,0.655,0.149,0.506
Fees for cash withdrawals,6,Currency exchange and withdrawal fees,24,Currency accounts and exchange fees,0.673,0.167,0.506
Trading Terminal,16,Revolut crypto trading and setup,27,Account security and fraud protection,0.638,0.129,0.509
Freeletics,13,Accessing Revolut plan benefits,15,Downgrading paid plans,0.611,0.101,0.511
I ordered a card and it didn't arrive,22,Ordering new cards,1,Card payment troubleshooting,0.634,0.121,0.513
How can I view my travel insurance policy documents?,0,Travel insurance trip coverage,25,Download account statements,0.718,0.203,0.515
Managing my eSIM data plan,23,eSIM data plan management,27,Account security and fraud protection,0.63,0.111,0.519
NordVPN,13,Accessing Revolut plan benefits,15,Downgrading paid plans,0.665,0.145,0.52
Sleep Cycle,13,Accessing Revolut plan benefits,15,Downgrading paid plans,0.642,0.121,0.521
Promotional and free trials,15,Downgrading paid plans,6,Currency exchange and withdrawal fees,0.652,0.13,0.522
Stock split,2,Trading order types,14,Crypto ETNs and ETPs,0.693,0.171,0.522
What is a special edition card?,22,Ordering new cards,1,Card payment troubleshooting,0.664,0.141,0.523
Getting started with Pet Insurance,0,Travel insurance trip coverage,18,Reporting vulnerable circumstances,0.704,0.178,0.526
Tinder,13,Accessing Revolut plan benefits,15,Downgrading paid plans,0.655,0.128,0.527
MasterClass,13,Accessing Revolut plan benefits,15,Downgrading paid plans,0.661,0.127,0.534
Refund protection coverage,0,Travel insurance trip coverage,13,Accessing Revolut plan benefits,0.651,0.115,0.536
Uber One,13,Accessing Revolut plan benefits,15,Downgrading paid plans,0.649,0.108,0.541
Chess.com,13,Accessing Revolut plan benefits,15,Downgrading paid plans,0.669,0.127,0.542
Mobile plan voice support,18,Reporting vulnerable circumstances,23,eSIM data plan management,0.68,0.138,0.543
Spare change and recurring Donations,26,Managing Revolut Pockets,12,RevPoints loyalty program,0.743,0.195,0.549
Why should I accept payments with Revolut Pro?,1,Card payment troubleshooting,4,Joint account closure,0.775,0.225,0.55
Close a stock position,2,Trading order types,4,Joint account closure,0.683,0.133,0.551
Who provides Revolut's everyday protection insurance?,0,Travel insurance trip coverage,15,Downgrading paid plans,0.701,0.142,0.558
Pending crypto deposits,9,Crypto deposit troubleshooting,16,Revolut crypto trading and setup,0.748,0.19,0.558
Cryptocurrencies and networks available for withdrawals,9,Crypto deposit troubleshooting,16,Revolut crypto trading and setup,0.709,0.149,0.561
I sent crypto to an incorrect wallet address. What can I do?,9,Crypto deposit troubleshooting,16,Revolut crypto trading and setup,0.758,0.19,0.569
Crypto limit order,2,Trading order types,16,Revolut crypto trading and setup,0.746,0.172,0.574
Event ticket cancellation protection coverage,0,Travel insurance trip coverage,15,Downgrading paid plans,0.678,0.102,0.575
Bond credit ratings,14,Crypto ETNs and ETPs,13,Accessing Revolut plan benefits,0.701,0.125,0.576
Crypto stop order,2,Trading order types,16,Revolut crypto trading and setup,0.756,0.179,0.577
ClassPass,13,Accessing Revolut plan benefits,15,Downgrading paid plans,0.694,0.114,0.58
Can I contact Revolut using a Power of Attorney?,18,Reporting vulnerable circumstances,3,Identity and account verification,0.759,0.177,0.582
Cards and currencies supported for adding money,8,Supported currencies and cards,1,Card payment troubleshooting,0.694,0.107,0.587
eSIM on Revolut Terminals,23,eSIM data plan management,9,Crypto deposit troubleshooting,0.701,0.112,0.589
Verify my identity,3,Identity and account verification,15,Downgrading paid plans,0.696,0.103,0.593
Locked bootloader requirement for Android devices,27,Account security and fraud protection,18,Reporting vulnerable circumstances,0.742,0.149,0.593
Contacting your device manufacturer,27,Account security and fraud protection,18,Reporting vulnerable circumstances,0.746,0.151,0.595
Manage a Stays booking,12,RevPoints loyalty program,18,Reporting vulnerable circumstances,0.738,0.14,0.598
What is a crypto market order?,2,Trading order types,16,Revolut crypto trading and setup,0.764,0.163,0.6
What does capital at risk mean?,14,Crypto ETNs and ETPs,16,Revolut crypto trading and setup,0.705,0.102,0.603
Take Profit and Stop Loss orders,2,Trading order types,6,Currency exchange and withdrawal fees,0.716,0.111,0.604
OTC stocks,2,Trading order types,6,Currency exchange and withdrawal fees,0.729,0.124,0.605
Referral reward smaller than expected,7,Referral purchase step requirements,22,Ordering new cards,0.71,0.105,0.605
Who is Revolut's travel insurance provider?,0,Travel insurance trip coverage,13,Accessing Revolut plan benefits,0.803,0.197,0.607
Stock delisting,2,Trading order types,6,Currency exchange and withdrawal fees,0.72,0.112,0.608
What happens once the gifted paid plan duration ends?,15,Downgrading paid plans,0,Travel insurance trip coverage,0.716,0.103,0.613
Picsart,13,Accessing Revolut plan benefits,15,Downgrading paid plans,0.717,0.103,0.613
My supplier won’t let me cancel my trip/event. Am I covered with Ultra trip and event cancellation protection?,0,Travel insurance trip coverage,15,Downgrading paid plans,0.736,0.121,0.615
Can I label my eSIM for my data plan?,23,eSIM data plan management,15,Downgrading paid plans,0.718,0.102,0.616
How do I make a protection insurance claim?,0,Travel insurance trip coverage,25,Download account statements,0.72,0.102,0.618
Can I use leverage to trade?,2,Trading order types,14,Crypto ETNs and ETPs,0.777,0.159,0.618
Get started with non-crypto ETPs,14,Crypto ETNs and ETPs,16,Revolut crypto trading and setup,0.728,0.107,0.621
How can I download trading statements and reports?,25,Download account statements,4,Joint account closure,0.744,0.121,0.623
Stocks and Shares Individual Savings Account (ISA),20,Tax and national identification,11,Transfer status and delays,0.733,0.109,0.623
Failed crypto deposits,9,Crypto deposit troubleshooting,6,Currency exchange and withdrawal fees,0.756,0.132,0.624
Where you can sign up for Revolut,8,Supported currencies and cards,4,Joint account closure,0.771,0.144,0.627
Graduation to the main app,10,Managing Kids and Teens accounts,4,Joint account closure,0.763,0.126,0.638
Submitting documents for a purchase insurance claim,0,Travel insurance trip coverage,25,Download account statements,0.746,0.107,0.639
What is a trading halt?,2,Trading order types,14,Crypto ETNs and ETPs,0.74,0.101,0.639
How do I upload a document?,3,Identity and account verification,25,Download account statements,0.782,0.138,0.644
Your paid plan subscription end date,15,Downgrading paid plans,13,Accessing Revolut plan benefits,0.781,0.121,0.66
Revolut closed my joint account,4,Joint account closure,21,External bank account transfers,0.765,0.101,0.664
Investing with the Stocks and Shares ISA,20,Tax and national identification,11,Transfer status and delays,0.767,0.102,0.665
Financial ratios for company analysis,2,Trading order types,14,Crypto ETNs and ETPs,0.833,0.167,0.665
Support if you are experiencing financial difficulties,18,Reporting vulnerable circumstances,20,Tax and national identification,0.835,0.165,0.669
How do I cancel my Pet Insurance policy?,0,Travel insurance trip coverage,17,Managing scheduled transfers,0.797,0.126,0.672
Get started with ETCs,14,Crypto ETNs and ETPs,2,Trading order types,0.775,0.101,0.674
Why is part of my Revolut X portfolio balance unavailable?,2,Trading order types,24,Currency accounts and exchange fees,0.79,0.106,0.684
What will happen to my Joint account?,4,Joint account closure,21,External bank account transfers,0.806,0.112,0.694
Failed orders in Revolut X,2,Trading order types,24,Currency accounts and exchange fees,0.816,0.121,0.695
Ultra trip & event cancellation with companion coverage,0,Travel insurance trip coverage,2,Trading order types,0.806,0.107,0.699
Bonds terms and definitions,2,Trading order types,15,Downgrading paid plans,0.828,0.121,0.707
Supported currencies for outgoing transfers,8,Supported currencies and cards,21,External bank account transfers,0.822,0.108,0.714
Discounts for loyal customers,15,Downgrading paid plans,6,Currency exchange and withdrawal fees,0.872,0.128,0.743
How do I share feedback with Revolut?,18,Reporting vulnerable circumstances,3,Identity and account verification,0.876,0.124,0.752
Redeeming RevPoints with Airline Miles,12,RevPoints loyalty program,18,Reporting vulnerable circumstances,0.879,0.121,0.758
Where can I get help if I'm worried about my mental health?,18,Reporting vulnerable circumstances,24,Currency accounts and exchange fees,0.883,0.117,0.766
