title,topic_1,label_1,topic_2,label_2,p1,p2,margin
How to withdraw cash from an ATM,6,Currency exchange and withdrawal fees,1,Card payment troubleshooting,0.389,0.206,0.183
How does Revolut process corporate actions?,2,Trading order types,27,Account security and fraud protection,0.457,0.273,0.183
How does the gambling block work?,5,Reporting phone and payment scams,18,Reporting vulnerable circumstances,0.368,0.185,0.183
Declined card payment isn't visible,1,Card payment troubleshooting,22,Ordering new cards,0.484,0.299,0.185
Revolut Kids & Teens Save,10,Managing Kids and Teens accounts,26,Managing Revolut Pockets,0.482,0.297,0.185
Managing a failed number transfer,11,Transfer status and delays,23,eSIM data plan management,0.454,0.269,0.185
Limits for using my card abroad,6,Currency exchange and withdrawal fees,24,Currency accounts and exchange fees,0.397,0.212,0.186
I can't add my card to Apple Pay,1,Card payment troubleshooting,22,Ordering new cards,0.358,0.172,0.186
I can't find my Vaults,26,Managing Revolut Pockets,19,FSCS protection for Revolut accounts,0.402,0.217,0.186
Can I transfer money to or from Russia or Belarus?,8,Supported currencies and cards,21,External bank account transfers,0.423,0.237,0.186
My beneficiary has not received my card transfer,11,Transfer status and delays,21,External bank account transfers,0.473,0.287,0.187
Hidden balance feature,24,Currency accounts and exchange fees,27,Account security and fraud protection,0.356,0.169,0.188
Security and data privacy,20,Tax and national identification,23,eSIM data plan management,0.483,0.294,0.189
Cards and contactless payments with Revolut Terminals,1,Card payment troubleshooting,8,Supported currencies and cards,0.493,0.304,0.19
Personal data required to create a Revolut account,3,Identity and account verification,23,eSIM data plan management,0.351,0.159,0.192
Trading watchlist and price alerts,2,Trading order types,3,Identity and account verification,0.303,0.108,0.195
What will happen to my account when it’s moved?,19,FSCS protection for Revolut accounts,4,Joint account closure,0.506,0.31,0.196
Can I receive my salary into my Revolut account?,21,External bank account transfers,11,Transfer status and delays,0.358,0.162,0.196
Plus plan,15,Downgrading paid plans,6,Currency exchange and withdrawal fees,0.38,0.183,0.197
How do I use a Revolut virtual card?,1,Card payment troubleshooting,22,Ordering new cards,0.458,0.26,0.198
View your crypto card payments,16,Revolut crypto trading and setup,1,Card payment troubleshooting,0.34,0.143,0.198
My card was stolen. What should I do?,1,Card payment troubleshooting,22,Ordering new cards,0.378,0.179,0.199
More help with a scheduled transfer,17,Managing scheduled transfers,11,Transfer status and delays,0.464,0.263,0.2
Tax on Savings,20,Tax and national identification,25,Download account statements,0.465,0.265,0.2
Bank transfer fees,21,External bank account transfers,11,Transfer status and delays,0.386,0.185,0.201
Metal plan,15,Downgrading paid plans,13,Accessing Revolut plan benefits,0.402,0.199,0.202
How to make sure crypto withdrawals are processed smoothly,9,Crypto deposit troubleshooting,16,Revolut crypto trading and setup,0.36,0.158,0.202
Download an account statement for a specific currency,25,Download account statements,24,Currency accounts and exchange fees,0.394,0.191,0.203
Open an investment account,20,Tax and national identification,3,Identity and account verification,0.393,0.19,0.203
Why is my withdrawal pending?,19,FSCS protection for Revolut accounts,21,External bank account transfers,0.355,0.152,0.204
Auto-renewing an eSIM data plan,23,eSIM data plan management,15,Downgrading paid plans,0.49,0.285,0.205
Crypto basics,16,Revolut crypto trading and setup,9,Crypto deposit troubleshooting,0.485,0.28,0.205
How to close a Revolut Pro account,4,Joint account closure,25,Download account statements,0.48,0.273,0.207
My card payment is pending,1,Card payment troubleshooting,11,Transfer status and delays,0.479,0.271,0.208
Revolut X fees,6,Currency exchange and withdrawal fees,24,Currency accounts and exchange fees,0.397,0.188,0.209
"Commodities prices, rates, and fees",6,Currency exchange and withdrawal fees,2,Trading order types,0.416,0.207,0.209
Turo rewards,13,Accessing Revolut plan benefits,15,Downgrading paid plans,0.389,0.179,0.21
Why your card top-ups may be blocked,21,External bank account transfers,1,Card payment troubleshooting,0.431,0.221,0.21
Will this affect my other Revolut products?,4,Joint account closure,10,Managing Kids and Teens accounts,0.402,0.192,0.21
Why is my card added to Click to Pay not shown at checkout?,1,Card payment troubleshooting,3,Identity and account verification,0.345,0.134,0.211
Reasons you can trust Revolut,27,Account security and fraud protection,23,eSIM data plan management,0.36,0.148,0.212
How to complete all steps for Referrals reward,7,Referral purchase step requirements,22,Ordering new cards,0.396,0.185,0.212
What are trading regulatory fees and taxes?,6,Currency exchange and withdrawal fees,2,Trading order types,0.483,0.269,0.213
Why did my payment amount change?,1,Card payment troubleshooting,11,Transfer status and delays,0.367,0.155,0.213
Why did I receive less crypto than I paid for?,16,Revolut crypto trading and setup,9,Crypto deposit troubleshooting,0.51,0.296,0.214
What exchange rates does Revolut offer?,24,Currency accounts and exchange fees,6,Currency exchange and withdrawal fees,0.446,0.231,0.215
Send or request money from other Revolut customers,21,External bank account transfers,6,Currency exchange and withdrawal fees,0.371,0.156,0.215
Does moving home affect Ultra trip and event coverage?,0,Travel insurance trip coverage,4,Joint account closure,0.361,0.142,0.218
How do I close my account?,4,Joint account closure,15,Downgrading paid plans,0.331,0.112,0.22
Premium plan,15,Downgrading paid plans,13,Accessing Revolut plan benefits,0.414,0.194,0.22
Why do I need to name the wallet owner for withdrawals?,9,Crypto deposit troubleshooting,20,Tax and national identification,0.494,0.27,0.224
"Now that Revolut is a bank, how is my money protected?",19,FSCS protection for Revolut accounts,4,Joint account closure,0.447,0.223,0.224
Using your credit card or a personal loan to trade stocks,14,Crypto ETNs and ETPs,2,Trading order types,0.55,0.325,0.225
My virtual card is not working,1,Card payment troubleshooting,22,Ordering new cards,0.506,0.281,0.225
Managing a mobile plan for a lost or stolen device,23,eSIM data plan management,3,Identity and account verification,0.395,0.17,0.225
Documents for a closed account ,3,Identity and account verification,25,Download account statements,0.463,0.238,0.225
Accessing the Retail Web App,3,Identity and account verification,23,eSIM data plan management,0.423,0.197,0.226
Can I get a VAT invoice for my Stays booking?,12,RevPoints loyalty program,18,Reporting vulnerable circumstances,0.419,0.193,0.226
Pet Insurance payments and renewals,0,Travel insurance trip coverage,15,Downgrading paid plans,0.462,0.236,0.226
Problems with a refund,11,Transfer status and delays,1,Card payment troubleshooting,0.482,0.254,0.227
How does Revolut protect me against fraud?,27,Account security and fraud protection,1,Card payment troubleshooting,0.374,0.146,0.228
A refund or chargeback was sent to my closed account,11,Transfer status and delays,21,External bank account transfers,0.392,0.161,0.23
"How to report a suspicious call, email, link, or text",5,Reporting phone and payment scams,18,Reporting vulnerable circumstances,0.391,0.16,0.23
What is a virtual card?,1,Card payment troubleshooting,22,Ordering new cards,0.49,0.259,0.231
Work at Revolut,13,Accessing Revolut plan benefits,16,Revolut crypto trading and setup,0.617,0.383,0.233
Download a transfer confirmation,11,Transfer status and delays,25,Download account statements,0.42,0.185,0.235
How does the commission-free allowance work?,6,Currency exchange and withdrawal fees,15,Downgrading paid plans,0.449,0.212,0.237
Paying a bill with new bank details? ,5,Reporting phone and payment scams,21,External bank account transfers,0.373,0.135,0.237
Currency exchange orders,2,Trading order types,24,Currency accounts and exchange fees,0.459,0.222,0.237
How to withdraw a foreign currency,24,Currency accounts and exchange fees,1,Card payment troubleshooting,0.377,0.139,0.238
Ukraine card top-up limits,8,Supported currencies and cards,1,Card payment troubleshooting,0.46,0.222,0.238
How can I see my travel analytics?,0,Travel insurance trip coverage,27,Account security and fraud protection,0.352,0.114,0.238
Do I have to pay for my trip using my Revolut account?,0,Travel insurance trip coverage,4,Joint account closure,0.364,0.124,0.239
Add money in one tap,21,External bank account transfers,1,Card payment troubleshooting,0.372,0.131,0.24
Get a Pockets statement,25,Download account statements,26,Managing Revolut Pockets,0.419,0.176,0.242
How to set up Direct Debits in Pro,17,Managing scheduled transfers,4,Joint account closure,0.42,0.178,0.242
Revolut — Kids & Teens subscription bundles,10,Managing Kids and Teens accounts,13,Accessing Revolut plan benefits,0.503,0.261,0.243
Received an unexpected link?,5,Reporting phone and payment scams,3,Identity and account verification,0.37,0.127,0.243
Have you been offered money to move funds?,5,Reporting phone and payment scams,4,Joint account closure,0.379,0.133,0.246
Who is Revolut Trading Ltd authorised by?,19,FSCS protection for Revolut accounts,20,Tax and national identification,0.506,0.257,0.249
Can I cover intermediary bank fees upfront?,6,Currency exchange and withdrawal fees,24,Currency accounts and exchange fees,0.406,0.155,0.251
Add money with a bank transfer,21,External bank account transfers,11,Transfer status and delays,0.5,0.249,0.251
My Ramp payment was completed but I didn’t receive the crypto. What should I do?,9,Crypto deposit troubleshooting,16,Revolut crypto trading and setup,0.568,0.316,0.252
Where can I find my Revolut Pro account in-app?,4,Joint account closure,1,Card payment troubleshooting,0.419,0.162,0.257
How will I know when my account has been moved?,4,Joint account closure,19,FSCS protection for Revolut accounts,0.478,0.22,0.258
Card verification and pre-authorisation,1,Card payment troubleshooting,22,Ordering new cards,0.479,0.221,0.258
Difference between Revolut Pro and Revolut Business,4,Joint account closure,24,Currency accounts and exchange fees,0.388,0.129,0.259
An urgent call out of the blue?,5,Reporting phone and payment scams,4,Joint account closure,0.371,0.111,0.26
Bring your number to Revolut mobile,23,eSIM data plan management,11,Transfer status and delays,0.472,0.212,0.26
Hidden accounts and transactions,4,Joint account closure,19,FSCS protection for Revolut accounts,0.425,0.164,0.261
Setting up Apple Pay,1,Card payment troubleshooting,22,Ordering new cards,0.435,0.173,0.262
When does my ATM withdrawal limit reset?,6,Currency exchange and withdrawal fees,15,Downgrading paid plans,0.512,0.251,0.262
How long will Revolut hold my data?,23,eSIM data plan management,27,Account security and fraud protection,0.408,0.146,0.262
Why was my transfer sent via an intermediary bank?,11,Transfer status and delays,21,External bank account transfers,0.502,0.239,0.263
Start with Revolut Ramp,16,Revolut crypto trading and setup,4,Joint account closure,0.41,0.147,0.263
How to disable RevPoints spare change?,12,RevPoints loyalty program,26,Managing Revolut Pockets,0.6,0.336,0.264
Missing reward from an influencer or brand signup,7,Referral purchase step requirements,15,Downgrading paid plans,0.424,0.156,0.267
My single-use virtual card isn't working,1,Card payment troubleshooting,22,Ordering new cards,0.5,0.232,0.267
Bonds fees,6,Currency exchange and withdrawal fees,24,Currency accounts and exchange fees,0.514,0.244,0.27
Why might my currency order fail or not execute?,2,Trading order types,24,Currency accounts and exchange fees,0.518,0.248,0.27
How do I complain about my pet insurance?,18,Reporting vulnerable circumstances,15,Downgrading paid plans,0.445,0.173,0.272
Buying something online?,5,Reporting phone and payment scams,21,External bank account transfers,0.388,0.114,0.274
How do regulatory limits affect my usage?,1,Card payment troubleshooting,3,Identity and account verification,0.453,0.177,0.276
Can I transfer my account from another broker?,11,Transfer status and delays,2,Trading order types,0.417,0.141,0.276
How to complete 'Add Money' step,7,Referral purchase step requirements,21,External bank account transfers,0.416,0.14,0.277
How to contact Revolut Support,18,Reporting vulnerable circumstances,13,Accessing Revolut plan benefits,0.495,0.218,0.277
What is the location-based security feature?,27,Account security and fraud protection,22,Ordering new cards,0.476,0.196,0.28
Crypto Learn,16,Revolut crypto trading and setup,9,Crypto deposit troubleshooting,0.477,0.197,0.281
Why can't I trade in Revolut X?,2,Trading order types,16,Revolut crypto trading and setup,0.487,0.204,0.283
Close my investment account,4,Joint account closure,20,Tax and national identification,0.456,0.173,0.283
What is a crypto ETN?,14,Crypto ETNs and ETPs,16,Revolut crypto trading and setup,0.511,0.225,0.286
Which countries can I send a card transfer to?,8,Supported currencies and cards,21,External bank account transfers,0.473,0.186,0.286
How does travel mode work?,27,Account security and fraud protection,15,Downgrading paid plans,0.398,0.111,0.287
Delayed (offline) card payments,1,Card payment troubleshooting,9,Crypto deposit troubleshooting,0.466,0.179,0.288
What should I do if my card is expiring soon?,22,Ordering new cards,1,Card payment troubleshooting,0.469,0.179,0.29
Managing a number transfer to Revolut,23,eSIM data plan management,11,Transfer status and delays,0.501,0.21,0.291
How long will the Authorised Push Payment fraud reimbursement process take?,11,Transfer status and delays,21,External bank account transfers,0.47,0.178,0.291
What is a fractional share?,2,Trading order types,14,Crypto ETNs and ETPs,0.527,0.235,0.292
Will the account transition have any tax implications?,20,Tax and national identification,4,Joint account closure,0.5,0.207,0.293
Am I eligible for Click to Pay?,8,Supported currencies and cards,1,Card payment troubleshooting,0.627,0.331,0.296
Send (withdraw) crypto to an external address,9,Crypto deposit troubleshooting,16,Revolut crypto trading and setup,0.507,0.209,0.298
Revolut – Kids & Teens card management,10,Managing Kids and Teens accounts,1,Card payment troubleshooting,0.47,0.171,0.299
About crypto unified balance,16,Revolut crypto trading and setup,24,Currency accounts and exchange fees,0.455,0.157,0.299
Crypto payments and how they work,16,Revolut crypto trading and setup,1,Card payment troubleshooting,0.444,0.145,0.299
When will I receive my Revolut Terminal?,22,Ordering new cards,11,Transfer status and delays,0.473,0.173,0.3
Service disruptions during transfer to Revolut,23,eSIM data plan management,11,Transfer status and delays,0.517,0.216,0.301
My Ramp transaction is completed but I didn't receive the funds,9,Crypto deposit troubleshooting,16,Revolut crypto trading and setup,0.493,0.192,0.301
Block or report another Revolut customer,5,Reporting phone and payment scams,26,Managing Revolut Pockets,0.417,0.115,0.301
Close a Pocket,26,Managing Revolut Pockets,4,Joint account closure,0.472,0.169,0.303
Spare change round ups,26,Managing Revolut Pockets,12,RevPoints loyalty program,0.46,0.156,0.304
Calculation of crypto tiered pricing,6,Currency exchange and withdrawal fees,24,Currency accounts and exchange fees,0.485,0.181,0.304
What are the fees for ordering a card?,22,Ordering new cards,6,Currency exchange and withdrawal fees,0.489,0.185,0.304
How does Bulgaria adopting the Euro affect me?,24,Currency accounts and exchange fees,6,Currency exchange and withdrawal fees,0.446,0.142,0.304
What are Payment Links and how do I use them?,1,Card payment troubleshooting,6,Currency exchange and withdrawal fees,0.454,0.149,0.305
What features are supported on the Web App?,27,Account security and fraud protection,25,Download account statements,0.567,0.261,0.306
Order a Joint account card,22,Ordering new cards,4,Joint account closure,0.478,0.171,0.307
Getting started with Savings,19,FSCS protection for Revolut accounts,4,Joint account closure,0.443,0.137,0.307
Crypto recurring buy,2,Trading order types,16,Revolut crypto trading and setup,0.504,0.196,0.309
Download your account confirmation,25,Download account statements,3,Identity and account verification,0.55,0.24,0.31
"I just made an exchange, but I can't find my money",24,Currency accounts and exchange fees,21,External bank account transfers,0.439,0.126,0.313
Why is my transfer to a bank account still pending?,11,Transfer status and delays,21,External bank account transfers,0.5,0.187,0.313
Which Revolut Trading entity is providing me services?,19,FSCS protection for Revolut accounts,2,Trading order types,0.658,0.342,0.316
Conditions for the referral campaign,7,Referral purchase step requirements,1,Card payment troubleshooting,0.467,0.148,0.319
Why is my Apple Pay card number different from my Revolut's?,1,Card payment troubleshooting,25,Download account statements,0.452,0.133,0.319
How does crypto staking work?,16,Revolut crypto trading and setup,14,Crypto ETNs and ETPs,0.474,0.154,0.32
Trading value limits,2,Trading order types,6,Currency exchange and withdrawal fees,0.539,0.218,0.321
Revolut crypto features and products,16,Revolut crypto trading and setup,9,Crypto deposit troubleshooting,0.549,0.225,0.324
Lost or stolen device,3,Identity and account verification,27,Account security and fraud protection,0.465,0.14,0.324
My friend hasn’t received the card. Will I get my reward?,7,Referral purchase step requirements,1,Card payment troubleshooting,0.485,0.161,0.324
Get paid early with Early Salary,21,External bank account transfers,24,Currency accounts and exchange fees,0.465,0.14,0.324
Limits for transfers to other Revolut customers,21,External bank account transfers,24,Currency accounts and exchange fees,0.469,0.143,0.327
How are trips defined for travel analytics?,0,Travel insurance trip coverage,27,Account security and fraud protection,0.453,0.126,0.327
Transfer your Revolut number to another provider,23,eSIM data plan management,15,Downgrading paid plans,0.508,0.176,0.332
What are Revolut Terminals?,1,Card payment troubleshooting,7,Referral purchase step requirements,0.509,0.176,0.333
Setting up scheduled payments to another Revolut customer,17,Managing scheduled transfers,0,Travel insurance trip coverage,0.503,0.169,0.334
Setting up Google Pay,1,Card payment troubleshooting,3,Identity and account verification,0.472,0.138,0.334
Understanding the account review process,3,Identity and account verification,27,Account security and fraud protection,0.668,0.332,0.335
Revolut.me link,1,Card payment troubleshooting,17,Managing scheduled transfers,0.474,0.138,0.336
Overview of Revolut Trading Ltd's omnibus account ,19,FSCS protection for Revolut accounts,14,Crypto ETNs and ETPs,0.526,0.191,0.336
Claiming special bonus offered by Revolut promotion,7,Referral purchase step requirements,1,Card payment troubleshooting,0.504,0.165,0.338
Buy and sell crypto,16,Revolut crypto trading and setup,2,Trading order types,0.553,0.214,0.339
Why was my outbound bank transfer reverted?,11,Transfer status and delays,21,External bank account transfers,0.553,0.213,0.339
Payment limits when using Apple Pay or Google Pay,1,Card payment troubleshooting,7,Referral purchase step requirements,0.577,0.238,0.339
Shops,12,RevPoints loyalty program,1,Card payment troubleshooting,0.509,0.169,0.34
What will happen to my funds if Revolut goes bankrupt?,19,FSCS protection for Revolut accounts,27,Account security and fraud protection,0.471,0.131,0.34
Download a cryptocurrency statement,25,Download account statements,16,Revolut crypto trading and setup,0.565,0.22,0.345
Trouble with my selfie verification for Wealth Protection,3,Identity and account verification,27,Account security and fraud protection,0.607,0.26,0.347
How to download a subject access request document,25,Download account statements,3,Identity and account verification,0.547,0.2,0.347
How to add money for the Referrals reward,7,Referral purchase step requirements,1,Card payment troubleshooting,0.499,0.152,0.347
Does moving home impact my travel insurance?,0,Travel insurance trip coverage,4,Joint account closure,0.467,0.117,0.35
Revolut – Kids & Teens cards,10,Managing Kids and Teens accounts,22,Ordering new cards,0.476,0.123,0.353
What if Revolut - Kids & Teens isn't available?,10,Managing Kids and Teens accounts,8,Supported currencies and cards,0.63,0.277,0.353
Cancelling or rescheduling a number transfer to Revolut,23,eSIM data plan management,11,Transfer status and delays,0.517,0.164,0.353
Pay with Revolut Ramp,16,Revolut crypto trading and setup,3,Identity and account verification,0.502,0.147,0.354
Revolut Business,4,Joint account closure,3,Identity and account verification,0.459,0.104,0.355
Why is my card transfer still pending?,11,Transfer status and delays,17,Managing scheduled transfers,0.532,0.178,0.355
Get started with crypto ETNs,14,Crypto ETNs and ETPs,16,Revolut crypto trading and setup,0.543,0.185,0.358
How do I link an external account to Revolut?,21,External bank account transfers,4,Joint account closure,0.468,0.109,0.359
How to redeem RevPoints for gift cards,12,RevPoints loyalty program,15,Downgrading paid plans,0.536,0.176,0.359
Pay for your missed plan payment,15,Downgrading paid plans,6,Currency exchange and withdrawal fees,0.509,0.149,0.36
Report a card payment as a scam or fraud,5,Reporting phone and payment scams,1,Card payment troubleshooting,0.538,0.177,0.361
Joint account card payments,4,Joint account closure,21,External bank account transfers,0.498,0.136,0.361
Exceeding my ISA allowance,20,Tax and national identification,6,Currency exchange and withdrawal fees,0.64,0.278,0.361
Can't see my deposit in-app,9,Crypto deposit troubleshooting,16,Revolut crypto trading and setup,0.561,0.2,0.361
Looking for a high return?,5,Reporting phone and payment scams,14,Crypto ETNs and ETPs,0.488,0.126,0.362
What happens if my joint account balance goes negative?,4,Joint account closure,1,Card payment troubleshooting,0.523,0.16,0.363
Add money to or withdraw from Revolut Kids & Teens account,10,Managing Kids and Teens accounts,21,External bank account transfers,0.494,0.13,0.364
Source of funds,3,Identity and account verification,25,Download account statements,0.537,0.173,0.364
Fees for trading crypto,6,Currency exchange and withdrawal fees,16,Revolut crypto trading and setup,0.511,0.146,0.364
Adding money to Pockets,26,Managing Revolut Pockets,24,Currency accounts and exchange fees,0.482,0.118,0.364
Dividends,20,Tax and national identification,2,Trading order types,0.506,0.141,0.365
How to ensure my crypto is transferred successfully?,9,Crypto deposit troubleshooting,16,Revolut crypto trading and setup,0.571,0.204,0.367
How to download a card confirmation document,25,Download account statements,3,Identity and account verification,0.555,0.187,0.368
Someone wants to give you a lot of money?,5,Reporting phone and payment scams,6,Currency exchange and withdrawal fees,0.533,0.166,0.368
Is my account eligible to be moved to Revolut Bank?,4,Joint account closure,19,FSCS protection for Revolut accounts,0.511,0.143,0.368
How are my investments with Revolut protected?,19,FSCS protection for Revolut accounts,14,Crypto ETNs and ETPs,0.558,0.188,0.37
Failed crypto withdrawals,9,Crypto deposit troubleshooting,16,Revolut crypto trading and setup,0.56,0.19,0.371
Difference between limited and full access to the web app,27,Account security and fraud protection,23,eSIM data plan management,0.511,0.14,0.371
Receive (deposit) crypto from an external address,9,Crypto deposit troubleshooting,16,Revolut crypto trading and setup,0.625,0.253,0.371
"My friend added money, but I still didn’t get the reward",7,Referral purchase step requirements,1,Card payment troubleshooting,0.479,0.106,0.373
Reactivate a card,22,Ordering new cards,1,Card payment troubleshooting,0.58,0.207,0.374
Buy order block,2,Trading order types,5,Reporting phone and payment scams,0.475,0.101,0.374
My card payment was declined,1,Card payment troubleshooting,22,Ordering new cards,0.576,0.199,0.376
I'm having trouble using my Revolut Terminal,23,eSIM data plan management,1,Card payment troubleshooting,0.571,0.196,0.376
Am I covered for trips or events that I didn't purchase with my Revolut account with Ultra trip and event cancellation protection?,0,Travel insurance trip coverage,4,Joint account closure,0.512,0.136,0.376
What is Dynamic Currency Conversion (DCC)?,24,Currency accounts and exchange fees,6,Currency exchange and withdrawal fees,0.626,0.249,0.377
Revolut mobile plans,23,eSIM data plan management,15,Downgrading paid plans,0.591,0.214,0.377
Switch your account to Revolut,4,Joint account closure,17,Managing scheduled transfers,0.547,0.169,0.378
Stake and unstake crypto,16,Revolut crypto trading and setup,9,Crypto deposit troubleshooting,0.611,0.231,0.379
Log in with a new phone number,3,Identity and account verification,23,eSIM data plan management,0.547,0.168,0.379
Add money with an easy bank transfer,21,External bank account transfers,11,Transfer status and delays,0.533,0.154,0.379
I received a transfer from an unknown sender,18,Reporting vulnerable circumstances,11,Transfer status and delays,0.63,0.25,0.38
Failed payment on Tap to Pay on iPhone,1,Card payment troubleshooting,8,Supported currencies and cards,0.545,0.163,0.382
How do I get the Clear Sky debit card?,22,Ordering new cards,1,Card payment troubleshooting,0.511,0.129,0.382
Buying a corporate bond vs buying stock in the same company,2,Trading order types,14,Crypto ETNs and ETPs,0.661,0.278,0.383
