title,topic_id
How to ensure my crypto is transferred successfully?,3
Crypto notifications,-1
Crypto recurring buy,0
Crypto rates and spread,-1
Fees for trading crypto,24
Crypto limit order,0
What is a crypto market order?,0
Crypto stop order,0
Crypto Learn,5
How does converting cryptocurrency to fiat currency work?,5
Crypto delisting,-1
Crypto account onboarding requirements,5
Other crypto token information,3
Revolut crypto features and products,5
Can I set target prices for exchanging cryptocurrency?,0
Receive (deposit) crypto from an external address,3
Return or manage crypto deposits,3
Failed crypto deposits,3
Addresses supported for withdrawing and reverting crypto deposits,3
Can't see my deposit in-app,3
Pending crypto deposits,3
"Supported crypto deposit currencies, networks, and exchanges",3
Do I have an individual cryptocurrency wallet?,5
Add a new wallet to withdraw crypto,-1
Crypto withdrawal fees,-1
Crypto withdrawal limits,24
Cryptocurrencies and networks available for withdrawals,3
Send (withdraw) crypto to an external address,3
Pending crypto withdrawals,3
Failed crypto withdrawals,3
Cryptocurrency networks,3
Buy and sell crypto,5
Crypto basics,5
Is my crypto safe with Revolut?,-1
Who provides Revolut's crypto services?,4
Taxes on crypto,5
Koinly crypto tax reports,5
Why do I need to name the wallet owner for withdrawals?,29
Crypto private keys and exposure on the blockchain,5
Crypto spare change,27
What exchange rates does Revolut offer?,-1
Currency exchange fees and limits,24
How do I exchange money?,16
Currency exchange orders,0
"I just made an exchange, but I can't find my money",16
Why might my currency order fail or not execute?,0
Open and manage additional currency accounts,16
Investor related tax information,29
How does the commission-free allowance work?,36
Trading orders routing,0
What are trading regulatory fees and taxes?,36
Buying or selling commodities,5
"Commodities prices, rates, and fees",-1
Commodities supported features,5
Which precious metals are supported?,5
Start with Revolut Ramp,5
How can I get a full statement of my Ramp transaction?,3
Pay with Revolut Ramp,3
What are the fees for Revolut Ramp?,-1
I sent crypto to an incorrect wallet address. What can I do?,3
I was charged extra by my bank for a Ramp payment. Why?,-1
My Ramp payment failed. What should I do?,21
My Ramp transaction is completed but I didn't receive the funds,3
My Ramp payment was completed but I didn’t receive the crypto. What should I do?,3
Revolut Ramp supported currencies and limits,5
Why did I receive less crypto than I paid for?,3
Why was I charged more than I was shown?,-1
Advantages of investing in bonds,35
Get started with Bonds,35
Bonds fees,36
Bonds terms and definitions,-1
Bond credit ratings,-1
Buy bonds in the Revolut app,0
Buying a corporate bond vs buying stock in the same company,35
Bond name interpretation in the Revolut app,-1
How does Revolut process corporate actions?,-1
Dividends,35
Merger or acquisition of a company whose shares I own,39
Stock delisting,0
Stock split,39
Trading customer support,4
Which Revolut Trading entity is providing me services?,4
Financial ratios for company analysis,39
Market analysis,0
OTC stocks,0
Stock basics,39
Stock markets,0
What is a fractional share?,39
What is a trading halt?,0
How do I update my trading account details?,10
Why are you asking me for documents to open or continue using Revolut trading?,25
Understanding our onboarding question about affiliations,29
Close my investment account,-1
Reasons an investment account may be closed,-1
How is the portfolio value calculated?,39
Overview of Revolut Trading Ltd's omnibus account ,26
Trading watchlist and price alerts,-1
"Trading account information, statements and reports",33
Trade confirmation statements,33
Fund my investment account,16
Using your credit card or a personal loan to trade stocks,17
How to withdraw funds from my investment account,-1
Open an investment account,29
Can I transfer my account from another broker?,-1
Why does Revolut need my national identifier?,29
What information do I need to provide to onboard to trading?,29
What is an execution-only service?,0
What is a Special Purpose Acquisition Company (SPAC)?,17
American depositary receipts (ADRs) and pass-through fees,36
Products available to trade,17
Can I have a trading account if I’m a US Person?,29
Who is Revolut Trading Ltd authorised by?,4
What are non-tradable securities?,-1
Do I own my stocks?,39
How are my investments with Revolut protected?,26
How are the funds in my investment account protected?,26
What does capital at risk mean?,17
Buy order block,0
Pending trading orders,0
Close a stock position,-1
How to place a stock order,0
Can I use leverage to trade?,-1
What is a GTC Order and how does it work?,0
Trading limit orders,0
What is a stop order?,0
Trading order types,0
Top Movers,-1
Security prices,0
What are Revolut's trading fees?,36
Trading value limits,0
Why is my stock on 'sell only'?,0
Orders submitted during extended hours trading,0
Extended hours trading risks,0
How extended hours trading works,0
What is a trading day?,0
Trading hours,0
What are the fees for Trading Pro?,36
What is Trading Pro?,36
